product_id,name,description,ingredients,concerns,category,price,product_file,best_seller,new_arrived,short_description,name_attributes,clean_name,search_text,price_range
1,Herforte Lotion Spray (to fill in gaps and treat alopecia),"Hair forte is a mixture of natural extracts and extracts of the most important hair oils with anti-dandruff agent, to be a quick treatment for hair loss, guaranteed and tested by dermatologists for fortifying hair & increase hair shaft strength to prevent hair loss. Also, Hair forte spray stimulates hair germination to be an effective solution to fill the frontal spaces in women and men, in addition to treating dandruff & itching associated with dryness and inflammation of the scalp, Hair forte spray is suitable for all hair types even oily & dry scalp. Composition:- Hair forte spray with its unique formula to be effective in stimulating the blood circulation of the scalp and hair follicles to strengthen and nourish them to prevent hair loss and also to stimulate root germination for the growth of healthy, thick, long and strong hair without dandruff. • Jojoba Oil Extract. • Garlic Oil Extract. • Nigella. • Rosemary. • Caffeine. • Thyme Oil. • Salicylic acid. • Panthenol. • Aloe Vera. • Vitamin E. Indicated for: *Diffuse hair fall. *Adjuvant therapy for alopecia areata. *Controls split ends, roughness, dryness& brittleness of hair. *Controls dandruff. Application: Spray onto wet or dry hair& scalp “6 pump” suitable amount then massage& style as usual, once or twice daily preferably start from the forehead to back of the head in a circular movement or as directed by physician. Package: 120 ml.","Jojoba Oil Extract, Garlic Oil Extract, Nigella, Rosemary, Caffeine, Thyme Oil, Salicylic acid, Panthenol, Aloe Vera, Vitamin E",Hair loss,"Hair Care, Hair spray& lotion",200.0,No file,True,False,Hair forte is a mixture of natural extracts and extracts of the most important hair oils with anti-d...,to fill in gaps and treat alopecia,Herforte Lotion Spray,"herforte lotion spray hair forte is a mixture of natural extracts and extracts of the most important hair oils with anti-dandruff agent, to be a quick treatment for hair loss, guaranteed and tested by dermatologists for fortifying hair & increase hair shaft strength to prevent hair loss. also, hair forte spray stimulates hair germination to be an effective solution to fill the frontal spaces in women and men, in addition to treating dandruff & itching associated with dryness and inflammation of the scalp, hair forte spray is suitable for all hair types even oily & dry scalp. composition:- hair forte spray with its unique formula to be effective in stimulating the blood circulation of the scalp and hair follicles to strengthen and nourish them to prevent hair loss and also to stimulate root germination for the growth of healthy, thick, long and strong hair without dandruff. • jojoba oil extract. • garlic oil extract. • nigella. • rosemary. • caffeine. • thyme oil. • salicylic acid. • panthenol. • aloe vera. • vitamin e. indicated for: *diffuse hair fall. *adjuvant therapy for alopecia areata. *controls split ends, roughness, dryness& brittleness of hair. *controls dandruff. application: spray onto wet or dry hair& scalp “6 pump” suitable amount then massage& style as usual, once or twice daily preferably start from the forehead to back of the head in a circular movement or as directed by physician. package: 120 ml. jojoba oil extract, garlic oil extract, nigella, rosemary, caffeine, thyme oil, salicylic acid, panthenol, aloe vera, vitamin e hair loss hair care, hair spray& lotion",201-500
2,Hairforte Shampoo (for treating hair loss and dandruff + deep moisturizing),"Hair Forte shampoo is an effective combination of anti-dandruff with natural extracts& important oils for hair to get rid of dandruff while nourishing &moisturizing hair to reduce hair falling also it helps in stimulating hair growth, Hair forte shampoo For Both Treated hair and Normal one. Composition: • Caffeine. • Jojoba Oil. • Lavender Oil. • Coconut Oil. • Olive Oil. • Rosemary Oil. • Vitamin E. • Panthenol. • Aloe Vera. • Zinc Pyrithione. • Garlic Extract. • Triclosan. Indicated for: *Treatment of dandruff. *Diffuse hair fall. *Adjuvant therapy for alopecia areata. *Controls split ends, roughness, dryness& brittleness of hair. Application: Apply a sufficient amount on wet hair and scalp, with gentle massage then rinse well with water from 1: 2 times weekly. Package: 120 ml.","Caffeine, Jojoba Oil, Lavender Oil, Coconut Oil, Olive Oil, Rosemary Oil, Vitamin E, Panthenol, Aloe Vera, Zinc Pyrithione, Garlic Extract, Triclosan",Dandruff,"Hair Care, Shampoos",150.0,No file,True,False,Hair Forte shampoo is an effective combination of anti-dandruff with natural extracts& important oil...,for treating hair loss and dandruff + deep moisturizing,Hairforte Shampoo,"hairforte shampoo hair forte shampoo is an effective combination of anti-dandruff with natural extracts& important oils for hair to get rid of dandruff while nourishing &moisturizing hair to reduce hair falling also it helps in stimulating hair growth, hair forte shampoo for both treated hair and normal one. composition: • caffeine. • jojoba oil. • lavender oil. • coconut oil. • olive oil. • rosemary oil. • vitamin e. • panthenol. • aloe vera. • zinc pyrithione. • garlic extract. • triclosan. indicated for: *treatment of dandruff. *diffuse hair fall. *adjuvant therapy for alopecia areata. *controls split ends, roughness, dryness& brittleness of hair. application: apply a sufficient amount on wet hair and scalp, with gentle massage then rinse well with water from 1: 2 times weekly. package: 120 ml. caffeine, jojoba oil, lavender oil, coconut oil, olive oil, rosemary oil, vitamin e, panthenol, aloe vera, zinc pyrithione, garlic extract, triclosan dandruff hair care, shampoos",101-200
3,Valdo moisturizing cream,"Valdo Moisturizing Cream -The best moisturizing cream for the face - hands - body and sensitive areas - -Valdo treats severe dryness and rebuilds the skin barrier. - Makes the skin soft and hydrated all day without scales -Valdo cream is rich in anti-inflammatory and antibacterial. -To treat skin infections and dissections also sunburn and burns first degree - -Accelerates wound healing. It is worth noting that its composition Valdo cream is rich in antioxidants. - Collagen stimulator to provide freshness and get rid of pallor and dullness. - Protection against the appearance of premature wrinkles - For all skin types (for dry skin - for oily skin - for combination and normal skin) Composition: Valdo cream is an ideal natural mix from most important natural extracts, oils& vitamins for complete skin care • Panthenol “Vitamin B5”. • Aloe Vera. • Calendula. • Almond Oil. • Olive Oil. • Allantoin.. • Glycerin. • Vitamin E. • Vitamin C. • Dimethicone. Indicated for: • Eczema. • Dry Skin. • Sun burn. • Burn “1st” degree. • Dipper rash. • Nipple Fissure. • Post Laser care. • After care of derma pen. • Reduce the early appearance of wrinkle. • Daily skin routine for glowing& taut look. • Adjuvant Therapy in Acne Vulgaris. Application:- Apply a suitable amount of the Valdo cream to skin twice daily. Package: 40gm.","Panthenol (Vitamin B5), Aloe Vera, Calendula, Almond Oil, Olive Oil, Allantoin, Glycerin, Vitamin E, Vitamin C, Dimethicone",Eczema & Dry skin,"Skin Care, Moisturizer",80.0,No file,True,False,Valdo Moisturizing Cream -The best moisturizing cream for the face - hands - body and sensitive area...,,Valdo moisturizing cream,"valdo moisturizing cream valdo moisturizing cream -the best moisturizing cream for the face - hands - body and sensitive areas - -valdo treats severe dryness and rebuilds the skin barrier. - makes the skin soft and hydrated all day without scales -valdo cream is rich in anti-inflammatory and antibacterial. -to treat skin infections and dissections also sunburn and burns first degree - -accelerates wound healing. it is worth noting that its composition valdo cream is rich in antioxidants. - collagen stimulator to provide freshness and get rid of pallor and dullness. - protection against the appearance of premature wrinkles - for all skin types (for dry skin - for oily skin - for combination and normal skin) composition: valdo cream is an ideal natural mix from most important natural extracts, oils& vitamins for complete skin care • panthenol “vitamin b5”. • aloe vera. • calendula. • almond oil. • olive oil. • allantoin.. • glycerin. • vitamin e. • vitamin c. • dimethicone. indicated for: • eczema. • dry skin. • sun burn. • burn “1st” degree. • dipper rash. • nipple fissure. • post laser care. • after care of derma pen. • reduce the early appearance of wrinkle. • daily skin routine for glowing& taut look. • adjuvant therapy in acne vulgaris. application:- apply a suitable amount of the valdo cream to skin twice daily. package: 40gm. panthenol (vitamin b5), aloe vera, calendula, almond oil, olive oil, allantoin, glycerin, vitamin e, vitamin c, dimethicone eczema & dry skin skin care, moisturizer",51-100
4,Spleet Cream Scrub (Steam Alternative + Acne Treatment),"Spleet is a gentle exfoliating cream with a unique triple action therapeutic formula for treating active acne, hidden pimple and dark spots, Spleet exfoliating has a soft peeling effect to remove dead skin buildup extremely dry, rough, scaly and aging skin Plus promoting a deep hydration that makes skin soft, smooth and less flaking. Spleet cream is safe for Face, hand, foot& full body and suitable for all kind of skin. Composition:- Spleet is an effective combination of the following:- • Urea • Salicylic Acid • Lactic Acid • Tea Tree Oil. • Chamomile. Indicated for: • Severe dry Skin. • Keratosis pilaris. • Cracked heel. • Rough, discolored elbow & knee. • Psoriasis patches. • Eczema. • Active acne. • Hidden pimple • Dark spots • Hydrate, brighten& smooth fine lines. Application:- Apply a suitable amount of the cream to skin once daily. For sensitive skin just applied for 5 minute then washed. Package: 40gm.","Urea, Salicylic Acid, Lactic Acid, Tea Tree Oil, Chamomile","Strawberry skin treatment, Acne& acne spots, Hyperpigmentation& dark spots, Sensitive areas& Bikini area brightening, Dull& pale skin","Personal Care, Soft peel and Exfoliant",100.0,No file,True,False,Spleet is a gentle exfoliating cream with a unique triple action therapeutic formula for treating ac...,Steam Alternative + Acne Treatment,Spleet Cream Scrub,"spleet cream scrub spleet is a gentle exfoliating cream with a unique triple action therapeutic formula for treating active acne, hidden pimple and dark spots, spleet exfoliating has a soft peeling effect to remove dead skin buildup extremely dry, rough, scaly and aging skin plus promoting a deep hydration that makes skin soft, smooth and less flaking. spleet cream is safe for face, hand, foot& full body and suitable for all kind of skin. composition:- spleet is an effective combination of the following:- • urea • salicylic acid • lactic acid • tea tree oil. • chamomile. indicated for: • severe dry skin. • keratosis pilaris. • cracked heel. • rough, discolored elbow & knee. • psoriasis patches. • eczema. • active acne. • hidden pimple • dark spots • hydrate, brighten& smooth fine lines. application:- apply a suitable amount of the cream to skin once daily. for sensitive skin just applied for 5 minute then washed. package: 40gm. urea, salicylic acid, lactic acid, tea tree oil, chamomile strawberry skin treatment, acne& acne spots, hyperpigmentation& dark spots, sensitive areas& bikini area brightening, dull& pale skin personal care, soft peel and exfoliant",101-200
5,Spleet Lightening Cream (for treating pigmentation and acne scars),"Spleet whitening cream offers the strongest unique natural formula that works through triple powers of lighten- moisturize& skin rejuvenation with triple different mechanisms of action for Achieving a de-pigmentation effect to lighten dark spots effectively & unify the skin tone hinder the development of dark patches and Keep skin hydrated& protected, it also stimulates collagen production and regulate sebum secretion to reduce the appearance of acne, pimple and large pores, Spleet whitening cream is sfor face, sensitive areas, under arm, bikini& full body and for All skin types “ dry skin - normal - mixed - oily or sensitive skin"" either for girls, women or men, Spleet whitening cream. Composition: Spleet whitening cream is a potent composition from triple groups of ingredients “skin lightening agents, skin exfoliating agents and skin moisturizing& antioxidant agents for treatment of hyperpigmentation and lighten dark spots effectively leaving skin hydrated and renewed. • Alpha- Arbutin, • Kojic Acid. • Niacinamide. • Licorice. • Glycolic Acid. • Vitamin A. • Vitamin C. • Vitamin E • Zinc oxid. • Allantoin. • Glycerin. Indicated for: o Sun Exposure. o Age Spots o Melasma. o Post Inflammatory hyperpigmentation as: • Acne scars. • Sunburn. • After care of chemical peels. • Post laser resurfacing. Applications: Apply a small amount on the face or area to be lightened once at night and may be repeated when needed. Package: 40gm.","Alpha-Arbutin, Kojic Acid, Niacinamide, Licorice, Glycolic Acid, Vitamin A, Vitamin C, Vitamin E, Zinc Oxide, Allantoin, Glycerin","Hyperpigmentation& dark spots, Sensitive areas& Bikini area brightening, Acne& acne spots","Skin Care, Whitening cream",100.0,No file,True,False,Spleet whitening cream offers the strongest unique natural formula that works through triple powers ...,for treating pigmentation and acne scars,Spleet Lightening Cream,"spleet lightening cream spleet whitening cream offers the strongest unique natural formula that works through triple powers of lighten- moisturize& skin rejuvenation with triple different mechanisms of action for achieving a de-pigmentation effect to lighten dark spots effectively & unify the skin tone hinder the development of dark patches and keep skin hydrated& protected, it also stimulates collagen production and regulate sebum secretion to reduce the appearance of acne, pimple and large pores, spleet whitening cream is sfor face, sensitive areas, under arm, bikini& full body and for all skin types “ dry skin - normal - mixed - oily or sensitive skin"" either for girls, women or men, spleet whitening cream. composition: spleet whitening cream is a potent composition from triple groups of ingredients “skin lightening agents, skin exfoliating agents and skin moisturizing& antioxidant agents for treatment of hyperpigmentation and lighten dark spots effectively leaving skin hydrated and renewed. • alpha- arbutin, • kojic acid. • niacinamide. • licorice. • glycolic acid. • vitamin a. • vitamin c. • vitamin e • zinc oxid. • allantoin. • glycerin. indicated for: o sun exposure. o age spots o melasma. o post inflammatory hyperpigmentation as: • acne scars. • sunburn. • after care of chemical peels. • post laser resurfacing. applications: apply a small amount on the face or area to be lightened once at night and may be repeated when needed. package: 40gm. alpha-arbutin, kojic acid, niacinamide, licorice, glycolic acid, vitamin a, vitamin c, vitamin e, zinc oxide, allantoin, glycerin hyperpigmentation& dark spots, sensitive areas& bikini area brightening, acne& acne spots skin care, whitening cream",101-200
6,Spleet Eye Contour Cream (for treating dark circles + expression lines + deep moisturizing),"An unique potent mix of natural ingredients those act with three functions “hydrate- brighten- firm” effectively addresses every single eye area concern- leaving the eye more brighter and smoother, that suitable for all kind of skin even sensitive skin. 1- Truly nourish the skin with multiple nutrients & vitamin as vitamin E& K and stimulating blood circulation plus deeply moisturize skin around the eyes for brightening skin, reducing the dark circles without clogging the pores. 2- Improving skin hydration and elasticity the eye contour area deeply plus antioxidant effect that will help in reliving of puffiness& eye fatigue. 3- Help in reducing the appearance of fine lines through promoting skin renewal and improving skin elasticity by stimulating of the collagen synthesis Composition: *Caffeine. *Liquorice Extract. *Vitamin A. *Green Tea. *Almond Oil. *Wheat Germ Oil. *Chamomile Extract. *Allantoin. *Royal Jelly. *Panthenol. *Collagen. Indicated for: • Treatment of all types of dark circles: Brown dark Circle due to hyperpigmentation “by Licorice” Black dark Circle due to lack of collagen and elasticity “by royal, panthenol & collagen” Blue dark Circle due to bad circulation “with caffeine& natural vitamin K extract”. • Moisturizes and strengthens the skin texture around the eyes. • Reduce the transparency of the tissues around the eye to reduce the appearance of dark circles. • Eye bag or puffiness. • Eraser of fine lines. • Relieve of eye fatigue. Application: Apply a small amount with gentle smoothing under the eye area, can be used alone or under makeup. Package: 30 gm.","Caffeine, Liquorice Extract, Vitamin A, Green Tea, Almond Oil, Wheat Germ Oil, Chamomile Extract, Allantoin, Royal Jelly, Panthenol, Collagen","Hyperpigmentation& dark spots, Dark circles “blue- brown- black” & puffiness","Skin Care, Eye cream",225.0,No file,True,False,An unique potent mix of natural ingredients those act with three functions “hydrate- brighten- firm”...,for treating dark circles + expression lines + deep moisturizing,Spleet Eye Contour Cream,"spleet eye contour cream an unique potent mix of natural ingredients those act with three functions “hydrate- brighten- firm” effectively addresses every single eye area concern- leaving the eye more brighter and smoother, that suitable for all kind of skin even sensitive skin. 1- truly nourish the skin with multiple nutrients & vitamin as vitamin e& k and stimulating blood circulation plus deeply moisturize skin around the eyes for brightening skin, reducing the dark circles without clogging the pores. 2- improving skin hydration and elasticity the eye contour area deeply plus antioxidant effect that will help in reliving of puffiness& eye fatigue. 3- help in reducing the appearance of fine lines through promoting skin renewal and improving skin elasticity by stimulating of the collagen synthesis composition: *caffeine. *liquorice extract. *vitamin a. *green tea. *almond oil. *wheat germ oil. *chamomile extract. *allantoin. *royal jelly. *panthenol. *collagen. indicated for: • treatment of all types of dark circles: brown dark circle due to hyperpigmentation “by licorice” black dark circle due to lack of collagen and elasticity “by royal, panthenol & collagen” blue dark circle due to bad circulation “with caffeine& natural vitamin k extract”. • moisturizes and strengthens the skin texture around the eyes. • reduce the transparency of the tissues around the eye to reduce the appearance of dark circles. • eye bag or puffiness. • eraser of fine lines. • relieve of eye fatigue. application: apply a small amount with gentle smoothing under the eye area, can be used alone or under makeup. package: 30 gm. caffeine, liquorice extract, vitamin a, green tea, almond oil, wheat germ oil, chamomile extract, allantoin, royal jelly, panthenol, collagen hyperpigmentation& dark spots, dark circles “blue- brown- black” & puffiness skin care, eye cream",201-500
7,Spleet Facial wash,"Spleet face wash with an unique the Canadian balanced formula that keeps skin pH balanced to be safe and suitable for all skin types that work with 5 power to give marvels 5 effects and effectiveness to show the beauty of the skin naturally and safely, as it helps to clean the skin for getting rid of accumulated makeup and debris to gives it a sense of freshness with an effect in lightening and enlightening the skin significantly, also helps it get rid of acne, pimples and reduce the appearance of enlarged pores and give a tightening of the skin because it is rich in collagen stimuli plus natural collagen with important vitamins those rejuvenate and tighten the skin to help it fight the appearance of early wrinkles leaving the skin deeply moisturized along the day. Composition: • Aloe Vera Extract. • Jojoba Oil. • Tocopherol. • Collagen. • Camellia Sinensis Extract. • Glycyrrhiza Glabra Leaf Extract. • Salicylic Acid. • Glycolic Acid. • Glycerin. • Glycine. Indicated for: • It cleans the skin effectively and safely. • Lighten skin color. • Moisturizing the skin deeply. • Treating Acne and pimples. • Rejuvenation and tightening of the skin. • Reduce the appearance of enlarged pores • Suitable for daily use. • A very small amount is sufficient. • Easy to rinse off. • Reduces fatty secretions. • Light and distinct scent. • Free of soap and does not cause clogged pores. Application: Apply a small amount on the face with a little of water, gently massage and then rinse, twice daily. Package: 200 ml.","Aloe Vera Extract, Jojoba Oil, Tocopherol, Collagen, Camellia Sinensis Extract, Glycyrrhiza Glabra Leaf Extract, Salicylic Acid, Glycolic Acid, Glycerin, Glycine","Acne& acne spots, Hyperpigmentation& dark spots, Dull& pale skin, Eczema & Dry skin","Skin Care, Cleansers",220.0,No file,True,False,Spleet face wash with an unique the Canadian balanced formula that keeps skin pH balanced to be safe...,,Spleet Facial wash,"spleet facial wash spleet face wash with an unique the canadian balanced formula that keeps skin ph balanced to be safe and suitable for all skin types that work with 5 power to give marvels 5 effects and effectiveness to show the beauty of the skin naturally and safely, as it helps to clean the skin for getting rid of accumulated makeup and debris to gives it a sense of freshness with an effect in lightening and enlightening the skin significantly, also helps it get rid of acne, pimples and reduce the appearance of enlarged pores and give a tightening of the skin because it is rich in collagen stimuli plus natural collagen with important vitamins those rejuvenate and tighten the skin to help it fight the appearance of early wrinkles leaving the skin deeply moisturized along the day. composition: • aloe vera extract. • jojoba oil. • tocopherol. • collagen. • camellia sinensis extract. • glycyrrhiza glabra leaf extract. • salicylic acid. • glycolic acid. • glycerin. • glycine. indicated for: • it cleans the skin effectively and safely. • lighten skin color. • moisturizing the skin deeply. • treating acne and pimples. • rejuvenation and tightening of the skin. • reduce the appearance of enlarged pores • suitable for daily use. • a very small amount is sufficient. • easy to rinse off. • reduces fatty secretions. • light and distinct scent. • free of soap and does not cause clogged pores. application: apply a small amount on the face with a little of water, gently massage and then rinse, twice daily. package: 200 ml. aloe vera extract, jojoba oil, tocopherol, collagen, camellia sinensis extract, glycyrrhiza glabra leaf extract, salicylic acid, glycolic acid, glycerin, glycine acne& acne spots, hyperpigmentation& dark spots, dull& pale skin, eczema & dry skin skin care, cleansers",201-500
12,Aceto-V Feminine Intimate wash,"Acet-V is a feminine Intimate wash with unique combination of real treatment for vaginal infection either bacterial or fungal plus moisturizers, tightening agents to enjoy daily activities& sexual intercourse. Composition:- *Chlorhexidine gluconate. *Cetrimide. *Aloe Vera. *Chamomile. *Glycerin. Indicated for: • Bacterial vaginosis. • Vaginal candidiasis. • Atrophic Vaginitis. • Vaginal irritation& itching. • Personal hygiene during menstrual cycle. • Personal hygiene after sexual intercourse. • Personal hygiene after Labor. • Tighten the vagina. Application:- Applied directly without dilution, once per day for external use only. Package: 250ml.","Chlorhexidine gluconate, Cetrimide, Aloe Vera, Chamomile, Glycerin",Sensitive areas& Bikini area brightening,"Personal Care, Cleansers",90.0,No file,False,False,Acet-V is a feminine Intimate wash with unique combination of real treatment for vaginal infection e...,,Aceto-V Feminine Intimate wash,"aceto-v feminine intimate wash acet-v is a feminine intimate wash with unique combination of real treatment for vaginal infection either bacterial or fungal plus moisturizers, tightening agents to enjoy daily activities& sexual intercourse. composition:- *chlorhexidine gluconate. *cetrimide. *aloe vera. *chamomile. *glycerin. indicated for: • bacterial vaginosis. • vaginal candidiasis. • atrophic vaginitis. • vaginal irritation& itching. • personal hygiene during menstrual cycle. • personal hygiene after sexual intercourse. • personal hygiene after labor. • tighten the vagina. application:- applied directly without dilution, once per day for external use only. package: 250ml. chlorhexidine gluconate, cetrimide, aloe vera, chamomile, glycerin sensitive areas& bikini area brightening personal care, cleansers",51-100
